<?xml version="1.0" encoding="UTF-8"?>
<Content xmlns:xsi="http://www.w3.org/2001/XMLSchema-instance" xsdVersion="0.10.0" efmiVersion="1.0.0" id="{e373002d-ae8b-49e8-adaa-e41da382f437}" name="OpenIPSL_CHIL.RTS.CHIL.Grid4CHIL_IOplus" description="System model for CHIL testing with more I/O" version="" generationDateAndTime="2026-04-20T12:08:36Z" generationTool="Dymola Version 2026x Refresh 1, 2026-04-08" xsi:noNamespaceSchemaLocation="./schemas/efmiContainerManifest.xsd">
    <ModelRepresentation name="ACode_Dymola" kind="AlgorithmCode" manifest="manifest.xml" checksum="a988cc8429ea5a811c64d52d44c64cafce41a1f5" manifestRefId="{15818fc0-e25c-4f55-8ddc-1ea301776896}"/>
    <ModelRepresentation name="PCode_SPE_cb4a8a449b4ada864625ee5a4355578a3aaf08ed" kind="ProductionCode" manifest="manifest.xml" checksum="3000a1609310283d8b12adf815930566fac4ba28" manifestRefId="{4d077650-cbd7-4444-947b-3943e61bed93}"/>
    <ModelRepresentation name="PCode_SPE_fba3e0dfa6c8985b41bcbe3594ee941ce98b740c" kind="ProductionCode" manifest="manifest.xml" checksum="53582b0b505d1e861466a02cd8a2c8c874eb3b77" manifestRefId="{a0198dbb-1b04-4018-82cd-891ef403558b}"/>
    <ModelRepresentation name="BCode_SPE_cb4a8a449b4ada864625ee5a4355578a3aaf08ed_121c3a3ad3761b859035224f0aa23f4d834544e7" kind="BinaryCode" manifest="manifest.xml" checksum="db63bcdc55b6fef99b659f76c137f594136b0414" manifestRefId="{b87bea65-d9bd-4823-853c-9d95b1c44460}"/>
    <ModelRepresentation name="BCode_SPE_cb4a8a449b4ada864625ee5a4355578a3aaf08ed_b48b2d90fa045262ae3c2a0df7ec20da237e1e13" kind="BinaryCode" manifest="manifest.xml" checksum="f23799d2a85cbb0293c0f0c1972b62896383a56c" manifestRefId="{c2ec471a-8ea2-40ea-98c2-ca28858bced2}"/>
    <ModelRepresentation name="BCode_SPE_fba3e0dfa6c8985b41bcbe3594ee941ce98b740c_121c3a3ad3761b859035224f0aa23f4d834544e7" kind="BinaryCode" manifest="manifest.xml" checksum="39443c8c333024f36d7711441abaa75765d826a3" manifestRefId="{224ebc83-a5ed-4078-b6eb-29cb0ac0e1f5}"/>
    <ModelRepresentation name="BCode_SPE_fba3e0dfa6c8985b41bcbe3594ee941ce98b740c_b48b2d90fa045262ae3c2a0df7ec20da237e1e13" kind="BinaryCode" manifest="manifest.xml" checksum="21aad1a4ee541d1658db59777388f54e9d95d472" manifestRefId="{fb3ba8a2-5f6a-40af-986a-cffce0790298}"/>
	<ModelRepresentation name="BModel_Dymola_4a73ad9f0950d19cf03cbedb79e4156cf8f7245d" kind="BehavioralModel" manifest="manifest.xml" checksum="52638d1cf90cc2d5151cf14998595f4e7ca35a4b" manifestRefId="{a0c370af-abfb-6d26-b21d-f5ebe09198b1}"/>
	<ModelRepresentation name="BModel_Dymola_85ea2c4fe158b21788342ca98d8496e27a8eb6fc" kind="BehavioralModel" manifest="manifest.xml" checksum="4b56b7fce974a858119c96ac741c8ce94bc303cc" manifestRefId="{49e499f2-745d-8df3-9d29-ef8781b57f54}"/>
</Content>
