<?xml version="1.0" encoding="UTF-8"?>
<Content xmlns:xsi="http://www.w3.org/2001/XMLSchema-instance" xsdVersion="0.10.0" efmiVersion="1.0.0" id="{8cb2aafb-1011-4184-9a3b-66482c4c913d}" name="OpenIPSL_CHIL.RTS.CHIL.Grid4CHIL_IOplus" description="System model for CHIL testing with more I/O" version="" generationDateAndTime="2026-03-26T03:53:23Z" generationTool="Dymola Version 2026x Refresh 1 Beta 1, 2026-02-27" xsi:noNamespaceSchemaLocation="./schemas/efmiContainerManifest.xsd">
    <ModelRepresentation name="ACode_Dymola" kind="AlgorithmCode" manifest="manifest.xml" checksum="b737e1c8377190e1e0e899001c2d3de702f2ad02" manifestRefId="{607f1679-ded2-455f-ad0b-fc5f5a4f83cb}"/>
    <ModelRepresentation name="PCode_SPE_cb4a8a449b4ada864625ee5a4355578a3aaf08ed" kind="ProductionCode" manifest="manifest.xml" checksum="78209ff8f34b1a935ef200be2449123c2f21d62c" manifestRefId="{8a87ab11-8105-4fb6-b01c-2cf961715df2}"/>
    <ModelRepresentation name="PCode_SPE_fba3e0dfa6c8985b41bcbe3594ee941ce98b740c" kind="ProductionCode" manifest="manifest.xml" checksum="5df44c583a249986007a9d022f5cc117cc4427e0" manifestRefId="{1d2a990a-5fe3-4f0f-9435-bf1ac945515d}"/>
    <ModelRepresentation name="BCode_SPE_cb4a8a449b4ada864625ee5a4355578a3aaf08ed_121c3a3ad3761b859035224f0aa23f4d834544e7" kind="BinaryCode" manifest="manifest.xml" checksum="1a63c4e8c592311670e9266d645b8ab99c659961" manifestRefId="{a7e1227b-267a-4e7b-885c-bdc9202cde09}"/>
    <ModelRepresentation name="BCode_SPE_cb4a8a449b4ada864625ee5a4355578a3aaf08ed_b48b2d90fa045262ae3c2a0df7ec20da237e1e13" kind="BinaryCode" manifest="manifest.xml" checksum="b49c113eb2e265bfcd868dd7678fd0be0cbd0cf2" manifestRefId="{50393cee-84ed-4718-a447-bc27eafdf49b}"/>
    <ModelRepresentation name="BCode_SPE_fba3e0dfa6c8985b41bcbe3594ee941ce98b740c_121c3a3ad3761b859035224f0aa23f4d834544e7" kind="BinaryCode" manifest="manifest.xml" checksum="2021762fc6ebd793f994c0c7e34f1761a92c1275" manifestRefId="{afe9c7cd-26c1-4659-8b8c-6b890de1e1da}"/>
    <ModelRepresentation name="BCode_SPE_fba3e0dfa6c8985b41bcbe3594ee941ce98b740c_b48b2d90fa045262ae3c2a0df7ec20da237e1e13" kind="BinaryCode" manifest="manifest.xml" checksum="449460f290d623bc04d537f9dd3f042d8b68abe4" manifestRefId="{2e781263-c3f6-4a27-911e-98bb45a78ad6}"/>
</Content>
