<?xml version="1.0" encoding="UTF-8"?>
<Content xmlns:xsi="http://www.w3.org/2001/XMLSchema-instance" xsdVersion="0.10.0" efmiVersion="1.0.0" id="{813ca981-5613-42b8-8b62-e4ee762cd970}" name="efmiPSSusecase.Components.PSSTypeIImod4efmi" description="Extends the PSS Type II in OpenIPSL with parametrization for eFMI use case" version="" generationDateAndTime="2025-10-27T17:06:18Z" generationTool="Dymola Version 2025x Refresh 1, 2025-04-11" xsi:noNamespaceSchemaLocation="./schemas\efmiContainerManifest.xsd">
    <ModelRepresentation name="ACode_Dymola" kind="AlgorithmCode" manifest="manifest.xml" checksum="7b24c4a4d7f97a5f0a3e58930baa4092492bde96" manifestRefId="{1376699c-b2d8-4069-a285-e4b58ce83b34}"/>
    <ModelRepresentation name="PCode_SPE_cb4a8a449b4ada864625ee5a4355578a3aaf08ed" kind="ProductionCode" manifest="manifest.xml" checksum="31b42af6ffdf815fea4c478065f5a59ddde9a96c" manifestRefId="{53161fae-c40a-422e-8e19-65b0c91dd88b}"/>
    <ModelRepresentation name="PCode_SPE_fba3e0dfa6c8985b41bcbe3594ee941ce98b740c" kind="ProductionCode" manifest="manifest.xml" checksum="db605b72f32e1631badac6a37e2dd06029630f84" manifestRefId="{9d2d5db1-1b0b-4343-b35c-ee1e9d78fb21}"/>
    <ModelRepresentation name="BCode_SPE_cb4a8a449b4ada864625ee5a4355578a3aaf08ed_121c3a3ad3761b859035224f0aa23f4d834544e7" kind="BinaryCode" manifest="manifest.xml" checksum="6147074643da8b9fd411b9ad7df9741150d15294" manifestRefId="{3c08f66c-70f2-456f-9c23-975eac8d0a43}"/>
    <ModelRepresentation name="BCode_SPE_cb4a8a449b4ada864625ee5a4355578a3aaf08ed_b48b2d90fa045262ae3c2a0df7ec20da237e1e13" kind="BinaryCode" manifest="manifest.xml" checksum="e845224c3230798a52d679e02f501b0a9e86d930" manifestRefId="{09e65ae3-98c2-45ab-bb58-4ac5cbe09988}"/>
    <ModelRepresentation name="BCode_SPE_fba3e0dfa6c8985b41bcbe3594ee941ce98b740c_121c3a3ad3761b859035224f0aa23f4d834544e7" kind="BinaryCode" manifest="manifest.xml" checksum="7e8454ac570a796bc90ee8e236c74ae92d15a74f" manifestRefId="{db2c2bda-0bd8-416a-8507-e7136d4eea5a}"/>
    <ModelRepresentation name="BCode_SPE_fba3e0dfa6c8985b41bcbe3594ee941ce98b740c_b48b2d90fa045262ae3c2a0df7ec20da237e1e13" kind="BinaryCode" manifest="manifest.xml" checksum="73c0440ddb3ad03cd67fd47592d3c73b602cb3ec" manifestRefId="{fd811c3b-1c09-4557-8dff-8e46fd545487}"/>
</Content>
