<?xml version="1.0" encoding="UTF-8"?>
<Content xmlns:xsi="http://www.w3.org/2001/XMLSchema-instance" xsdVersion="0.10.0" efmiVersion="1.0.0" id="{ef5003d9-f5df-453d-b40b-8672a93c06fb}" name="PSSDesign.eFMU4CHIL.Grid4CHILTesting" description="System model for CHIL testing" version="" generationDateAndTime="2026-02-27T15:56:46Z" generationTool="Dymola Version 2026x Refresh 1 Beta 1, 2026-02-27" xsi:noNamespaceSchemaLocation="./schemas/efmiContainerManifest.xsd">
    <ModelRepresentation name="ACode_Dymola" kind="AlgorithmCode" manifest="manifest.xml" checksum="6c18713de7d5e3c69c96af11dd21f425b0fc36c7" manifestRefId="{b61d78ad-bf35-4975-9033-902708882880}"/>
    <ModelRepresentation name="PCode_SPE_cb4a8a449b4ada864625ee5a4355578a3aaf08ed" kind="ProductionCode" manifest="manifest.xml" checksum="b801b8f39d04fa25e4a415ffb88ec00a1bd66006" manifestRefId="{0f8d2715-f4ab-455d-9aa5-fb7af245c0b9}"/>
    <ModelRepresentation name="PCode_SPE_fba3e0dfa6c8985b41bcbe3594ee941ce98b740c" kind="ProductionCode" manifest="manifest.xml" checksum="2fb2411cea571e8601f512475d9e7b2d7022607c" manifestRefId="{7a2decfc-5f8d-46ee-a482-c7261e169bf5}"/>
    <ModelRepresentation name="BCode_SPE_cb4a8a449b4ada864625ee5a4355578a3aaf08ed_121c3a3ad3761b859035224f0aa23f4d834544e7" kind="BinaryCode" manifest="manifest.xml" checksum="9dbc28d18122f4f10922080be12171416a6b8a7f" manifestRefId="{877e0c72-c939-47a3-8a32-07b99995ed48}"/>
    <ModelRepresentation name="BCode_SPE_cb4a8a449b4ada864625ee5a4355578a3aaf08ed_b48b2d90fa045262ae3c2a0df7ec20da237e1e13" kind="BinaryCode" manifest="manifest.xml" checksum="f6e215401130af402250a1e6d7be0a8a1a6cd722" manifestRefId="{bf44a4a1-c702-4294-9b48-42b20d69a451}"/>
    <ModelRepresentation name="BCode_SPE_fba3e0dfa6c8985b41bcbe3594ee941ce98b740c_121c3a3ad3761b859035224f0aa23f4d834544e7" kind="BinaryCode" manifest="manifest.xml" checksum="62f3444424eb8674c5b2d392a42e2537a3520e9f" manifestRefId="{64a9487f-0ff5-4894-8c87-83f532f4ba39}"/>
    <ModelRepresentation name="BCode_SPE_fba3e0dfa6c8985b41bcbe3594ee941ce98b740c_b48b2d90fa045262ae3c2a0df7ec20da237e1e13" kind="BinaryCode" manifest="manifest.xml" checksum="43b2d969455e7ca127b394a34ef5d8da61fd88d1" manifestRefId="{13c6b710-6dce-40b3-84b7-59f84cf9ffc3}"/>
	<ModelRepresentation name="BModel_Dymola_d180f6f1e15ef8acfcad8cba73e6b4c1641111e4" kind="BehavioralModel" manifest="manifest.xml" checksum="e772780ae7509f9222c0c06d4dcae4993b3f14df" manifestRefId="{d163c228-89d4-5b13-a05c-2d1b48e52ebc}"/>
</Content>
