<?xml version="1.0" encoding="UTF-8"?>
<Content xmlns:xsi="http://www.w3.org/2001/XMLSchema-instance" xsdVersion="0.10.0" efmiVersion="1.0.0" id="{98b74a94-240b-44af-be7d-588dab760eb9}" name="OpenIPSL_CHIL.Components.PSS.PSSTypeIISimpleHPF" description="PSS Type II of OpenIPSL with parametrization for eFMI use-case, replacing the derivative filter with a simplified HPF implementation." version="" generationDateAndTime="2026-03-15T04:43:34Z" generationTool="Dymola Version 2026x Refresh 1 Beta 1, 2026-02-27" xsi:noNamespaceSchemaLocation="./schemas/efmiContainerManifest.xsd">
    <ModelRepresentation name="ACode_Dymola" kind="AlgorithmCode" manifest="manifest.xml" checksum="7e9dbf9783e958c649a2c045c271437537eb206f" manifestRefId="{e3edde6d-a095-4d24-9686-6686b1b72b71}"/>
    <ModelRepresentation name="PCode_SPE_cb4a8a449b4ada864625ee5a4355578a3aaf08ed" kind="ProductionCode" manifest="manifest.xml" checksum="75ca1528a73b8c8c167656154a9afb4f0f6f2b49" manifestRefId="{cdcc2da6-18af-4fd7-89b8-d204283ec77e}"/>
    <ModelRepresentation name="PCode_SPE_fba3e0dfa6c8985b41bcbe3594ee941ce98b740c" kind="ProductionCode" manifest="manifest.xml" checksum="054fa0d836c3ff2c4affc2f73e59a6f8f59a3e6b" manifestRefId="{faa97a85-daf4-4303-b230-94bc48264523}"/>
    <ModelRepresentation name="BCode_SPE_cb4a8a449b4ada864625ee5a4355578a3aaf08ed_121c3a3ad3761b859035224f0aa23f4d834544e7" kind="BinaryCode" manifest="manifest.xml" checksum="d52b9b499f6e066c28775c80a1627a6e224e76d7" manifestRefId="{004a1ee9-8b5c-4074-a629-08353afe9052}"/>
    <ModelRepresentation name="BCode_SPE_cb4a8a449b4ada864625ee5a4355578a3aaf08ed_b48b2d90fa045262ae3c2a0df7ec20da237e1e13" kind="BinaryCode" manifest="manifest.xml" checksum="2b0c4bbca243924e23c0a9878c2b6cc6b4d0d11f" manifestRefId="{17fc054e-bc1a-463a-8eba-37b908c42497}"/>
    <ModelRepresentation name="BCode_SPE_fba3e0dfa6c8985b41bcbe3594ee941ce98b740c_121c3a3ad3761b859035224f0aa23f4d834544e7" kind="BinaryCode" manifest="manifest.xml" checksum="494e6a3fea74450f4d7bb816ae92a4ceb74d14c2" manifestRefId="{4e65571f-2a4d-4e61-8078-57ca5fc611ba}"/>
    <ModelRepresentation name="BCode_SPE_fba3e0dfa6c8985b41bcbe3594ee941ce98b740c_b48b2d90fa045262ae3c2a0df7ec20da237e1e13" kind="BinaryCode" manifest="manifest.xml" checksum="e37ee02d2d199583a00083894bb80272098c7d16" manifestRefId="{7f906d5c-2a87-46c2-8ac8-0962653e1523}"/>
	<ModelRepresentation name="BModel_Dymola_1d004974f9b717eea6bd89dae3a804d101968ef8" kind="BehavioralModel" manifest="manifest.xml" checksum="ffad059e990cdf1648a42d1fcb3b3df11e7d5e07" manifestRefId="{aec97202-cf65-dabb-9908-425fb0f97c14}"/>
</Content>
