<?xml version="1.0" encoding="UTF-8"?>
<Content xmlns:xsi="http://www.w3.org/2001/XMLSchema-instance" xsdVersion="0.10.0" efmiVersion="1.0.0" id="{9f25553f-0445-4894-a7c2-4fc474739d7c}" name="PSSDesign.eFMU4CHIL.Grid4CHILTesting" description="System model for CHIL testing" version="" generationDateAndTime="2026-01-14T21:38:43Z" generationTool="Dymola Version 2026x Refresh 1 Dev 3, 2026-01-23" xsi:noNamespaceSchemaLocation="./schemas\efmiContainerManifest.xsd">
    <ModelRepresentation name="ACode_Dymola" kind="AlgorithmCode" manifest="manifest.xml" checksum="c81c0307c6279283e35adde3ae442086fe44dca6" manifestRefId="{1d85c16f-835a-4842-9bbe-4f71fe66f112}"/>
    <ModelRepresentation name="PCode_SPE_cb4a8a449b4ada864625ee5a4355578a3aaf08ed" kind="ProductionCode" manifest="manifest.xml" checksum="c15c3b865774fea9b7a017dff3d05dfba3d5c3a5" manifestRefId="{b7d34c62-17f3-4f7d-aa91-2e763f8e1773}"/>
    <ModelRepresentation name="PCode_SPE_fba3e0dfa6c8985b41bcbe3594ee941ce98b740c" kind="ProductionCode" manifest="manifest.xml" checksum="a2c358e30aa54a430608e5ed421dfe194f5e2e1b" manifestRefId="{0b09f1bb-c5c8-4693-bddc-e0545535ccf2}"/>
    <ModelRepresentation name="BCode_SPE_cb4a8a449b4ada864625ee5a4355578a3aaf08ed_121c3a3ad3761b859035224f0aa23f4d834544e7" kind="BinaryCode" manifest="manifest.xml" checksum="69772fc6d2caeee0133fd2d672ff8cced2b0c5ac" manifestRefId="{06e58c42-bd96-4010-966b-fb3be9d586a7}"/>
    <ModelRepresentation name="BCode_SPE_cb4a8a449b4ada864625ee5a4355578a3aaf08ed_b48b2d90fa045262ae3c2a0df7ec20da237e1e13" kind="BinaryCode" manifest="manifest.xml" checksum="89e06e15396dca0bd0f90ca7f90a468fa1b06607" manifestRefId="{d3cc1ca3-421d-4fd3-9ad1-c0c7e5ef4e23}"/>
    <ModelRepresentation name="BCode_SPE_fba3e0dfa6c8985b41bcbe3594ee941ce98b740c_121c3a3ad3761b859035224f0aa23f4d834544e7" kind="BinaryCode" manifest="manifest.xml" checksum="0da9fc854de53ace75b22cc85d6099bf5abc335b" manifestRefId="{55d730f4-efee-4176-a951-51c40cefe7cd}"/>
    <ModelRepresentation name="BCode_SPE_fba3e0dfa6c8985b41bcbe3594ee941ce98b740c_b48b2d90fa045262ae3c2a0df7ec20da237e1e13" kind="BinaryCode" manifest="manifest.xml" checksum="7bb988427e8f53225307dc345486a9ab6388ff76" manifestRefId="{ecca49c1-151b-4c5f-ad75-a97d8535d9dd}"/>
</Content>
