<?xml version="1.0" encoding="UTF-8"?>
<Content xmlns:xsi="http://www.w3.org/2001/XMLSchema-instance" xsdVersion="0.10.0" efmiVersion="1.0.0" id="{9ee2acd4-d27d-4704-b590-3c28fa53fb49}" name="PSSDesign.eFMUs4RTHIL.GridForHILTesting" description="System model for HIL testing" version="" generationDateAndTime="2025-11-03T22:18:16Z" generationTool="Dymola Version 2025x Refresh 1, 2025-04-11" xsi:noNamespaceSchemaLocation="./schemas\efmiContainerManifest.xsd">
    <ModelRepresentation name="ACode_Dymola" kind="AlgorithmCode" manifest="manifest.xml" checksum="ad8f7fba253328366e5cef1d02b0e071d5b6036e" manifestRefId="{7c3adc9e-74e8-4d94-8d7c-9e9b688cac66}"/>
    <ModelRepresentation name="PCode_SPE_cb4a8a449b4ada864625ee5a4355578a3aaf08ed" kind="ProductionCode" manifest="manifest.xml" checksum="6721c436e00cfdb0033117ecfba9699fbfedfce0" manifestRefId="{bf57db72-e400-4c35-9d0a-ff31736bb4a2}"/>
    <ModelRepresentation name="PCode_SPE_fba3e0dfa6c8985b41bcbe3594ee941ce98b740c" kind="ProductionCode" manifest="manifest.xml" checksum="abe26514af1d66a1c30569276123c3df0b23de78" manifestRefId="{de47d5c5-5ee1-43ba-9603-d213aedff13d}"/>
    <ModelRepresentation name="BCode_SPE_cb4a8a449b4ada864625ee5a4355578a3aaf08ed_121c3a3ad3761b859035224f0aa23f4d834544e7" kind="BinaryCode" manifest="manifest.xml" checksum="997cf45917e9183ac9d04c6e898105feb8ee8346" manifestRefId="{500065f1-1c92-4e03-b4f6-8120da24e7f8}"/>
    <ModelRepresentation name="BCode_SPE_cb4a8a449b4ada864625ee5a4355578a3aaf08ed_b48b2d90fa045262ae3c2a0df7ec20da237e1e13" kind="BinaryCode" manifest="manifest.xml" checksum="036b12b8b14aa20b82b9cdaf683351bf969b4eae" manifestRefId="{f6f833ff-dd0d-450b-90bd-61b23dd9bec9}"/>
    <ModelRepresentation name="BCode_SPE_fba3e0dfa6c8985b41bcbe3594ee941ce98b740c_121c3a3ad3761b859035224f0aa23f4d834544e7" kind="BinaryCode" manifest="manifest.xml" checksum="aa19be92fb06ccc44cac221755623b241bc36fd9" manifestRefId="{0eefa453-af47-41a7-bf49-877fb87def3d}"/>
    <ModelRepresentation name="BCode_SPE_fba3e0dfa6c8985b41bcbe3594ee941ce98b740c_b48b2d90fa045262ae3c2a0df7ec20da237e1e13" kind="BinaryCode" manifest="manifest.xml" checksum="eccda2f8653e16bce08a199a386e9268f009f42e" manifestRefId="{86de149e-b63b-4946-9d7a-7008065e3007}"/>
	<ModelRepresentation name="BModel_Dymola_38088f85a1446bf88ee25daf1830f6a8d82bce99" kind="BehavioralModel" manifest="manifest.xml" checksum="f0b5db12ffd4f19490c8ff1dbe50c04e6b44d0f4" manifestRefId="{ee4c1542-505d-5270-b31f-23e3b59f368b}"/>
</Content>
