<?xml version="1.0" encoding="UTF-8"?>
<Content xmlns:xsi="http://www.w3.org/2001/XMLSchema-instance" xsdVersion="0.10.0" efmiVersion="1.0.0" id="{360a7fe8-3f07-4d13-9185-a5ca60359416}" name="PSSDesign.Components.PSSTypeII4eFMI" description="PSS Type II of OpenIPSL with parametrization for eFMI use-case." version="" generationDateAndTime="2026-02-27T16:07:10Z" generationTool="Dymola Version 2026x Refresh 1 Beta 1, 2026-02-27" xsi:noNamespaceSchemaLocation="./schemas/efmiContainerManifest.xsd">
    <ModelRepresentation name="ACode_Dymola" kind="AlgorithmCode" manifest="manifest.xml" checksum="0b1f722a09b535dd17fc3f7cb7eaeeec74cc046b" manifestRefId="{17deebad-9daf-4310-b39a-5076aad6f45b}"/>
    <ModelRepresentation name="PCode_SPE_cb4a8a449b4ada864625ee5a4355578a3aaf08ed" kind="ProductionCode" manifest="manifest.xml" checksum="a81948451fdb6de44c0a58d8b68df81bf1db6f9d" manifestRefId="{b57c201e-46a4-444c-8ba8-e4e75187cd2f}"/>
    <ModelRepresentation name="PCode_SPE_fba3e0dfa6c8985b41bcbe3594ee941ce98b740c" kind="ProductionCode" manifest="manifest.xml" checksum="05392456d0924ee15a7de0f2f74e16546a471f8b" manifestRefId="{be3710c5-03ca-4e2e-b939-393f29cf4f47}"/>
    <ModelRepresentation name="BCode_SPE_cb4a8a449b4ada864625ee5a4355578a3aaf08ed_121c3a3ad3761b859035224f0aa23f4d834544e7" kind="BinaryCode" manifest="manifest.xml" checksum="0ae0f6110d3115b926ef88c9839f5fb025fb9f85" manifestRefId="{6a0f3098-b934-4087-a99c-c8f4c3c1c640}"/>
    <ModelRepresentation name="BCode_SPE_cb4a8a449b4ada864625ee5a4355578a3aaf08ed_b48b2d90fa045262ae3c2a0df7ec20da237e1e13" kind="BinaryCode" manifest="manifest.xml" checksum="e3bc79b00b557ecd33f2d2386873d9ac7cf1acb7" manifestRefId="{0d158377-b80e-4cc8-b359-93a762478f96}"/>
    <ModelRepresentation name="BCode_SPE_fba3e0dfa6c8985b41bcbe3594ee941ce98b740c_121c3a3ad3761b859035224f0aa23f4d834544e7" kind="BinaryCode" manifest="manifest.xml" checksum="b89119c0e9a019eac0d2cca1a35552cd6463e6c5" manifestRefId="{d29c36f6-5c69-4cde-b4bb-a36aa2b3a256}"/>
    <ModelRepresentation name="BCode_SPE_fba3e0dfa6c8985b41bcbe3594ee941ce98b740c_b48b2d90fa045262ae3c2a0df7ec20da237e1e13" kind="BinaryCode" manifest="manifest.xml" checksum="0ed9e5153c3645bc75b6637658c67929351f661b" manifestRefId="{37e6523e-a52b-4a7d-8982-170d9b0f7318}"/>
	<ModelRepresentation name="BModel_Dymola_1cdf13902f8ff1051dd45e29521f833634c3c750" kind="BehavioralModel" manifest="manifest.xml" checksum="b7382398ef33bda9a4a12245e955fd5b81b8afe2" manifestRefId="{99e05f12-2d9b-42e6-b07b-8b6358ec78f9}"/>
</Content>
