<?xml version="1.0" encoding="UTF-8"?>
<Content xmlns:xsi="http://www.w3.org/2001/XMLSchema-instance" xsdVersion="0.10.0" efmiVersion="1.0.0" id="{8a3cb5c5-d6cd-4739-8ffd-40d4ed45b990}" name="efmiPSSusecase.Components.PSSTypeIImod4efmi" description="Extends the PSS Type II in OpenIPSL with parametrization for eFMI use case" version="" generationDateAndTime="2025-10-28T03:07:14Z" generationTool="Dymola Version 2025x Refresh 1, 2025-04-11" xsi:noNamespaceSchemaLocation="./schemas\efmiContainerManifest.xsd">
    <ModelRepresentation name="ACode_Dymola" kind="AlgorithmCode" manifest="manifest.xml" checksum="8d6618e575568248d2c175353ec7fc7bbd026f3d" manifestRefId="{e0dd1bd3-9257-4699-8fb8-3210401074e2}"/>
    <ModelRepresentation name="PCode_SPE_cb4a8a449b4ada864625ee5a4355578a3aaf08ed" kind="ProductionCode" manifest="manifest.xml" checksum="e65ab9848030c763fba4163c1f9d481c48460c63" manifestRefId="{c06b46e1-6d59-4af9-8866-4740ccf69ae4}"/>
    <ModelRepresentation name="PCode_SPE_fba3e0dfa6c8985b41bcbe3594ee941ce98b740c" kind="ProductionCode" manifest="manifest.xml" checksum="66bb5b2734b6ce38e8280c06769f08b23fff0497" manifestRefId="{c94988a2-5a7e-45c0-bec5-d0e40e84213c}"/>
    <ModelRepresentation name="BCode_SPE_cb4a8a449b4ada864625ee5a4355578a3aaf08ed_121c3a3ad3761b859035224f0aa23f4d834544e7" kind="BinaryCode" manifest="manifest.xml" checksum="8e9115e6c30798ed44211d88a7575a1076b18c44" manifestRefId="{798fd7bd-ca51-4810-96f3-033cd52eb27c}"/>
    <ModelRepresentation name="BCode_SPE_cb4a8a449b4ada864625ee5a4355578a3aaf08ed_b48b2d90fa045262ae3c2a0df7ec20da237e1e13" kind="BinaryCode" manifest="manifest.xml" checksum="51872046109a934902cdfd853e043cc452dda1b1" manifestRefId="{50d64050-68d8-4d1e-b68d-014b77b73e06}"/>
    <ModelRepresentation name="BCode_SPE_fba3e0dfa6c8985b41bcbe3594ee941ce98b740c_121c3a3ad3761b859035224f0aa23f4d834544e7" kind="BinaryCode" manifest="manifest.xml" checksum="fd3fa1fc32a9158df9c6e005c2835b1a37e60e38" manifestRefId="{faec7b0a-a280-4c85-a9b2-8d02415593fc}"/>
    <ModelRepresentation name="BCode_SPE_fba3e0dfa6c8985b41bcbe3594ee941ce98b740c_b48b2d90fa045262ae3c2a0df7ec20da237e1e13" kind="BinaryCode" manifest="manifest.xml" checksum="3645f51ef6e34601c4d6f5b9d5ed60b48f159ec7" manifestRefId="{ce4ad299-34c8-4c5f-9359-c246b9ae7ddb}"/>
	<ModelRepresentation name="BModel_Dymola_200c711367943bdee125301112f1e06ff95def82" kind="BehavioralModel" manifest="manifest.xml" checksum="ca9a5f6ad5cdf660318e5ec5f8e7b2ac92c9b11a" manifestRefId="{bf41f1b6-cead-d650-8ded-ce83e4cd1ab8}"/>
</Content>
