<?xml version="1.0" encoding="UTF-8"?>
<Content xmlns:xsi="http://www.w3.org/2001/XMLSchema-instance" xsdVersion="0.10.0" efmiVersion="1.0.0" id="{6ddd92cf-b966-4040-9787-9540d5fd3e47}" name="PSSDesign.Components.PSSTypeII4eFMIwHPFilter" description="PSS Type II of OpenIPSL with parametrization for eFMI use-case, replacing the derivative filter with a high-pass filter." version="" generationDateAndTime="2026-03-03T10:26:15Z" generationTool="Dymola Version 2026x Refresh 1 Beta 1, 2026-02-27" xsi:noNamespaceSchemaLocation="./schemas/efmiContainerManifest.xsd">
    <ModelRepresentation name="ACode_Dymola" kind="AlgorithmCode" manifest="manifest.xml" checksum="e144568397a3657c9c3ba84bccb9351d85c41de0" manifestRefId="{5e379857-3631-4e14-bae0-e284cd1e6072}"/>
    <ModelRepresentation name="PCode_SPE_cb4a8a449b4ada864625ee5a4355578a3aaf08ed" kind="ProductionCode" manifest="manifest.xml" checksum="4527d898b72700c6026dbac2471a6e7d9ad1e996" manifestRefId="{cb650783-f1b0-4d3e-95ed-5d2a14814093}"/>
    <ModelRepresentation name="PCode_SPE_fba3e0dfa6c8985b41bcbe3594ee941ce98b740c" kind="ProductionCode" manifest="manifest.xml" checksum="f99ba1d7dffe1c2d8093008fe6f271a571947fda" manifestRefId="{4b88a86e-42cb-404f-89a7-9a0cdf26db8d}"/>
    <ModelRepresentation name="BCode_SPE_cb4a8a449b4ada864625ee5a4355578a3aaf08ed_121c3a3ad3761b859035224f0aa23f4d834544e7" kind="BinaryCode" manifest="manifest.xml" checksum="d3d4fdbcdbef21d52ddc4ffac9e726e5f786b122" manifestRefId="{9fa868cf-9d20-4dd4-ab23-da6cb7842f20}"/>
    <ModelRepresentation name="BCode_SPE_cb4a8a449b4ada864625ee5a4355578a3aaf08ed_b48b2d90fa045262ae3c2a0df7ec20da237e1e13" kind="BinaryCode" manifest="manifest.xml" checksum="619cd0a59a2083e9ac328c243f9d3e7a80faa7e2" manifestRefId="{56da2349-36ea-48b4-a258-df5de84adc3b}"/>
    <ModelRepresentation name="BCode_SPE_fba3e0dfa6c8985b41bcbe3594ee941ce98b740c_121c3a3ad3761b859035224f0aa23f4d834544e7" kind="BinaryCode" manifest="manifest.xml" checksum="10513bec15ffe65f2a52936d19ef0542433a8937" manifestRefId="{91dccd07-6889-4a7c-8c4a-9708b7f4bdde}"/>
    <ModelRepresentation name="BCode_SPE_fba3e0dfa6c8985b41bcbe3594ee941ce98b740c_b48b2d90fa045262ae3c2a0df7ec20da237e1e13" kind="BinaryCode" manifest="manifest.xml" checksum="2f5c2d974e1e62c221eb78f7ffea583e2eaee217" manifestRefId="{4a6c5cb1-580a-4031-8659-6b3193c4629c}"/>
	<ModelRepresentation name="BModel_Dymola_43208c169d9bdb09c2bacd04d247e2fdecfa2b90" kind="BehavioralModel" manifest="manifest.xml" checksum="4ff608fddbb3c8305c13609189d7f75c9d4d1623" manifestRefId="{3acf3862-b690-81f4-a45e-5a349eaf326f}"/>
</Content>
