<?xml version="1.0" encoding="UTF-8"?>
<Content xmlns:xsi="http://www.w3.org/2001/XMLSchema-instance" xsdVersion="0.10.0" efmiVersion="1.0.0" id="{894e3f3f-1015-4b51-9c68-b73a549441eb}" name="OpenIPSL_CHIL.RTS.HIL.Grid4HIL" description="System model for HIL testing" version="" generationDateAndTime="2026-03-26T03:09:38Z" generationTool="Dymola Version 2026x Refresh 1 Beta 1, 2026-02-27" xsi:noNamespaceSchemaLocation="./schemas/efmiContainerManifest.xsd">
    <ModelRepresentation name="ACode_Dymola" kind="AlgorithmCode" manifest="manifest.xml" checksum="352facd730e882b3d6f7c2cc8d3a7d8b3af2025b" manifestRefId="{7f103539-80ce-44ff-882a-875da8793609}"/>
    <ModelRepresentation name="PCode_SPE_cb4a8a449b4ada864625ee5a4355578a3aaf08ed" kind="ProductionCode" manifest="manifest.xml" checksum="838c7e65390b8ec8aedb02bbada0ebcd0c77dfe5" manifestRefId="{80a54e87-7fce-40c5-b5d8-8bb4fd94781b}"/>
    <ModelRepresentation name="PCode_SPE_fba3e0dfa6c8985b41bcbe3594ee941ce98b740c" kind="ProductionCode" manifest="manifest.xml" checksum="027778b72a51faca8ecba79382197961cee5f05d" manifestRefId="{0f3e4f73-2204-4970-a992-e9fe71e29b93}"/>
    <ModelRepresentation name="BCode_SPE_cb4a8a449b4ada864625ee5a4355578a3aaf08ed_121c3a3ad3761b859035224f0aa23f4d834544e7" kind="BinaryCode" manifest="manifest.xml" checksum="240a35939b1bc32ad0b9f9332936c1389cec9e49" manifestRefId="{ac6fe8a4-eaa9-43d8-b2d3-9ee848a861f3}"/>
    <ModelRepresentation name="BCode_SPE_cb4a8a449b4ada864625ee5a4355578a3aaf08ed_b48b2d90fa045262ae3c2a0df7ec20da237e1e13" kind="BinaryCode" manifest="manifest.xml" checksum="ae9a7b1b0971b1d1e8f510b8c62b33bcc39dc642" manifestRefId="{62605ee6-97c7-46c9-a6d8-d9395683a8e6}"/>
    <ModelRepresentation name="BCode_SPE_fba3e0dfa6c8985b41bcbe3594ee941ce98b740c_121c3a3ad3761b859035224f0aa23f4d834544e7" kind="BinaryCode" manifest="manifest.xml" checksum="07bc04654bf91486d183a7c1f5d11ce9e0f49d2d" manifestRefId="{2dd8280d-d339-4375-985a-20e1ef247029}"/>
    <ModelRepresentation name="BCode_SPE_fba3e0dfa6c8985b41bcbe3594ee941ce98b740c_b48b2d90fa045262ae3c2a0df7ec20da237e1e13" kind="BinaryCode" manifest="manifest.xml" checksum="e78395f824c5a355b40b5bf85552bc26f0f3d16c" manifestRefId="{8e8f9891-aeb3-4675-8bd8-3554bda50e8e}"/>
</Content>
