<?xml version="1.0" encoding="UTF-8"?>
<Content xmlns:xsi="http://www.w3.org/2001/XMLSchema-instance" xsdVersion="0.10.0" efmiVersion="1.0.0" id="{0ac509a6-fef4-4d59-9eac-824c81af7eef}" name="PSSDesign.eFMUs4RTHIL.GridForHILTesting" description="System model for HIL testing" version="" generationDateAndTime="2026-02-27T16:02:34Z" generationTool="Dymola Version 2026x Refresh 1 Beta 1, 2026-02-27" xsi:noNamespaceSchemaLocation="./schemas/efmiContainerManifest.xsd">
    <ModelRepresentation name="ACode_Dymola" kind="AlgorithmCode" manifest="manifest.xml" checksum="44634521f66b7f15610c5850781cf1cf65e44299" manifestRefId="{22f67e14-13b4-4fa1-8be1-693428df2f9a}"/>
    <ModelRepresentation name="PCode_SPE_cb4a8a449b4ada864625ee5a4355578a3aaf08ed" kind="ProductionCode" manifest="manifest.xml" checksum="1ebf071ad8d70e6e0986af0603314015ae5e2dfc" manifestRefId="{76585fc5-3f57-41c7-be97-e4f87f8af9d4}"/>
    <ModelRepresentation name="PCode_SPE_fba3e0dfa6c8985b41bcbe3594ee941ce98b740c" kind="ProductionCode" manifest="manifest.xml" checksum="55c8e5f2efa43589971802b9bf901d0813519cd3" manifestRefId="{dc6d1dca-d424-4893-959f-fc61e57b71ec}"/>
    <ModelRepresentation name="BCode_SPE_cb4a8a449b4ada864625ee5a4355578a3aaf08ed_121c3a3ad3761b859035224f0aa23f4d834544e7" kind="BinaryCode" manifest="manifest.xml" checksum="c32d521abb370c850150a0e3b74413fb8ddfb000" manifestRefId="{4550895a-c1cf-4ebf-9581-f9aa4c2f2fe3}"/>
    <ModelRepresentation name="BCode_SPE_cb4a8a449b4ada864625ee5a4355578a3aaf08ed_b48b2d90fa045262ae3c2a0df7ec20da237e1e13" kind="BinaryCode" manifest="manifest.xml" checksum="a36c2e9bf9e91280ded7e8389b67c19909b98a3b" manifestRefId="{16946e2a-afb8-401e-9f80-fc33e12e9fdd}"/>
    <ModelRepresentation name="BCode_SPE_fba3e0dfa6c8985b41bcbe3594ee941ce98b740c_121c3a3ad3761b859035224f0aa23f4d834544e7" kind="BinaryCode" manifest="manifest.xml" checksum="71eebdd7be333f59b61c41b7f5d7c7fa1b086947" manifestRefId="{7b08d1c8-728e-4e31-80b5-cf14cc3c6b41}"/>
    <ModelRepresentation name="BCode_SPE_fba3e0dfa6c8985b41bcbe3594ee941ce98b740c_b48b2d90fa045262ae3c2a0df7ec20da237e1e13" kind="BinaryCode" manifest="manifest.xml" checksum="58e39c7948efd5e39d65eb053edb53d1983fb7bf" manifestRefId="{b6d1e60f-4606-4cd3-8187-02640b503e09}"/>
	<ModelRepresentation name="BModel_Dymola_84ea38ca266d48efbba62d5a36b7852196882e14" kind="BehavioralModel" manifest="manifest.xml" checksum="c7d0b1e3b4740ead854c5e7d238f87fe49ed96ca" manifestRefId="{d379d48e-a01b-e2d6-b609-d3a9080ead14}"/>
</Content>
