<?xml version="1.0" encoding="UTF-8"?>
<Content xmlns:xsi="http://www.w3.org/2001/XMLSchema-instance" xsdVersion="0.10.0" efmiVersion="1.0.0" id="{1715ccab-7af7-4da2-9975-a7d48e4d1535}" name="PSSDesign.eFMU4CHIL.Grid4CHILTesting" description="System model for CHIL testing" version="" generationDateAndTime="2026-01-14T21:29:42Z" generationTool="Dymola Version 2026x Refresh 1 Dev 3, 2026-01-23" xsi:noNamespaceSchemaLocation="./schemas\efmiContainerManifest.xsd">
    <ModelRepresentation name="ACode_Dymola" kind="AlgorithmCode" manifest="manifest.xml" checksum="be43d28f95ff13a35b9baf6f245b9d8e64bd790e" manifestRefId="{2c59452b-b650-45be-ac21-c6cf78ea50b8}"/>
    <ModelRepresentation name="PCode_SPE_cb4a8a449b4ada864625ee5a4355578a3aaf08ed" kind="ProductionCode" manifest="manifest.xml" checksum="5ab10b0fd39908b3e3acb66a06d9d946002d213b" manifestRefId="{bc06a6f1-b408-4251-b0a5-5776f237b753}"/>
    <ModelRepresentation name="PCode_SPE_fba3e0dfa6c8985b41bcbe3594ee941ce98b740c" kind="ProductionCode" manifest="manifest.xml" checksum="19193550efc9fb22e7f65b5edeee59000aba1084" manifestRefId="{4cf18360-c33c-450b-a025-76c3cfc49ec4}"/>
    <ModelRepresentation name="BCode_SPE_cb4a8a449b4ada864625ee5a4355578a3aaf08ed_121c3a3ad3761b859035224f0aa23f4d834544e7" kind="BinaryCode" manifest="manifest.xml" checksum="2aa9fa85ef10903623f2a61b188b692fe1ea7925" manifestRefId="{525f21c8-73c5-4a22-8327-11041879fd75}"/>
    <ModelRepresentation name="BCode_SPE_cb4a8a449b4ada864625ee5a4355578a3aaf08ed_b48b2d90fa045262ae3c2a0df7ec20da237e1e13" kind="BinaryCode" manifest="manifest.xml" checksum="65d763c1a91ff8e3e59737f182b6cc87c1319796" manifestRefId="{b28f2f98-473c-4e0c-bbcd-ab4905f892ce}"/>
    <ModelRepresentation name="BCode_SPE_fba3e0dfa6c8985b41bcbe3594ee941ce98b740c_121c3a3ad3761b859035224f0aa23f4d834544e7" kind="BinaryCode" manifest="manifest.xml" checksum="8b733d6c44b5cb77e9d6ffb09a2f09f98c493d04" manifestRefId="{63004bcc-8b85-43d7-9dbe-bd9372eebf43}"/>
    <ModelRepresentation name="BCode_SPE_fba3e0dfa6c8985b41bcbe3594ee941ce98b740c_b48b2d90fa045262ae3c2a0df7ec20da237e1e13" kind="BinaryCode" manifest="manifest.xml" checksum="e9fda2e26c7119a1cb7bdddc173c54a61ab35179" manifestRefId="{85ddbe06-9e03-40cb-90ce-e1e42ef0ef04}"/>
	<ModelRepresentation name="BModel_Dymola_39849b3d3faae9e13019d91d2c75061e5270bd02" kind="BehavioralModel" manifest="manifest.xml" checksum="6d4334d468a6caf0278bc0aa1d750651d6667e37" manifestRefId="{96571812-e7fe-ce02-8651-6c5ca5e6482a}"/>
</Content>
