<?xml version="1.0" encoding="UTF-8"?>
<Content xmlns:xsi="http://www.w3.org/2001/XMLSchema-instance" xsdVersion="0.10.0" efmiVersion="1.0.0" id="{efeae231-03eb-4e2d-90c4-4f0ae308e890}" name="efmiPSSusecase.Components.PSSTypeIImod4efmi" description="Extends the PSS Type II in OpenIPSL with parametrization for eFMI use case" version="" generationDateAndTime="2025-11-03T21:57:41Z" generationTool="Dymola Version 2025x Refresh 1, 2025-04-11" xsi:noNamespaceSchemaLocation="./schemas\efmiContainerManifest.xsd">
    <ModelRepresentation name="ACode_Dymola" kind="AlgorithmCode" manifest="manifest.xml" checksum="e3a46a67da07267c813efed966a9b02f90a372e7" manifestRefId="{33d18b22-02c5-473f-8df5-de72c8fb98a3}"/>
    <ModelRepresentation name="PCode_SPE_cb4a8a449b4ada864625ee5a4355578a3aaf08ed" kind="ProductionCode" manifest="manifest.xml" checksum="d6f264a1017d936b988bb633341223ad4f72cf9a" manifestRefId="{e8da5fb2-613e-4b90-9868-b969397e642e}"/>
    <ModelRepresentation name="PCode_SPE_fba3e0dfa6c8985b41bcbe3594ee941ce98b740c" kind="ProductionCode" manifest="manifest.xml" checksum="ce36b66aaa2ee7e14ec57a4921683fa5aa1157cf" manifestRefId="{f73729df-2996-4270-9e52-7e619b8796b7}"/>
    <ModelRepresentation name="BCode_SPE_cb4a8a449b4ada864625ee5a4355578a3aaf08ed_121c3a3ad3761b859035224f0aa23f4d834544e7" kind="BinaryCode" manifest="manifest.xml" checksum="93d71c3ffd48f19d7125a906ccf0b55ff9a2c337" manifestRefId="{4e223749-11bf-4609-b09a-6f2f80b4266a}"/>
    <ModelRepresentation name="BCode_SPE_cb4a8a449b4ada864625ee5a4355578a3aaf08ed_b48b2d90fa045262ae3c2a0df7ec20da237e1e13" kind="BinaryCode" manifest="manifest.xml" checksum="dd97ad782e0e3c55f95f2086a078e7d83e478897" manifestRefId="{fa04d005-1529-47fc-a239-8d48e567126d}"/>
    <ModelRepresentation name="BCode_SPE_fba3e0dfa6c8985b41bcbe3594ee941ce98b740c_121c3a3ad3761b859035224f0aa23f4d834544e7" kind="BinaryCode" manifest="manifest.xml" checksum="c2edd7f1a1b568da3001d95b9751bba832154964" manifestRefId="{6d678e57-c6a6-4b79-964a-96c5a54f8222}"/>
    <ModelRepresentation name="BCode_SPE_fba3e0dfa6c8985b41bcbe3594ee941ce98b740c_b48b2d90fa045262ae3c2a0df7ec20da237e1e13" kind="BinaryCode" manifest="manifest.xml" checksum="c09c9f4d9334330f36414cf5ac74a351b35ef333" manifestRefId="{9c1c592a-1ae5-4e5b-935f-fbfbedb18c3a}"/>
	<ModelRepresentation name="BModel_Dymola_200c711367943bdee125301112f1e06ff95def82" kind="BehavioralModel" manifest="manifest.xml" checksum="3137847a6571baf37af8eedb25b0397fc70ae30f" manifestRefId="{92be29eb-73a4-cde6-88c0-4c992a5ecf11}"/>
	<ModelRepresentation name="BModel_Dymola_a3e95f8bfc8f7111ce0a5afbe91c98b3a0600eff" kind="BehavioralModel" manifest="manifest.xml" checksum="9b5c962f8791edcccad21e846e7ea3fada4270b0" manifestRefId="{49f3903f-58d5-cdc2-88e9-1a806da5c7f5}"/>
</Content>
