<?xml version="1.0" encoding="UTF-8"?>
<Content xmlns:xsi="http://www.w3.org/2001/XMLSchema-instance" xsdVersion="0.10.0" efmiVersion="1.0.0" id="{0730f363-cbe7-4347-8666-5602085b0a49}" name="efmiPSSusecase.Components.PSSTypeIImod4efmi" description="Extends the PSS Type II in OpenIPSL with parametrization for eFMI use case" version="" generationDateAndTime="2025-12-22T20:21:20Z" generationTool="Dymola Version 2025x Refresh 1, 2025-04-11" xsi:noNamespaceSchemaLocation="./schemas\efmiContainerManifest.xsd">
    <ModelRepresentation name="ACode_Dymola" kind="AlgorithmCode" manifest="manifest.xml" checksum="1552344066bf3f9a8777d165f77b6995fff7f0f2" manifestRefId="{09129c14-23f9-485c-8038-8d798f99cc0e}"/>
    <ModelRepresentation name="PCode_SPE_cb4a8a449b4ada864625ee5a4355578a3aaf08ed" kind="ProductionCode" manifest="manifest.xml" checksum="ae48cfad2e8d4376e65d13564866bb2a2c1265cd" manifestRefId="{04a74503-45f7-48de-ae75-cee4bfc5c7bf}"/>
    <ModelRepresentation name="PCode_SPE_fba3e0dfa6c8985b41bcbe3594ee941ce98b740c" kind="ProductionCode" manifest="manifest.xml" checksum="ac7a36aa25ba02d2c239a588bed6089567bd9905" manifestRefId="{362ac730-6fed-4d55-97fc-36ce8a9dd24e}"/>
    <ModelRepresentation name="BCode_SPE_cb4a8a449b4ada864625ee5a4355578a3aaf08ed_121c3a3ad3761b859035224f0aa23f4d834544e7" kind="BinaryCode" manifest="manifest.xml" checksum="8a72bdc41c6aef736ee72feb78c9cc8807ca27cf" manifestRefId="{e5bad1ce-bea6-4d08-b270-b3bec00f8fb6}"/>
    <ModelRepresentation name="BCode_SPE_cb4a8a449b4ada864625ee5a4355578a3aaf08ed_b48b2d90fa045262ae3c2a0df7ec20da237e1e13" kind="BinaryCode" manifest="manifest.xml" checksum="c933efe84bf6bc8f0233c35baf0c6f03d10cec51" manifestRefId="{7da1083e-677e-4716-b565-badc9364c251}"/>
    <ModelRepresentation name="BCode_SPE_fba3e0dfa6c8985b41bcbe3594ee941ce98b740c_121c3a3ad3761b859035224f0aa23f4d834544e7" kind="BinaryCode" manifest="manifest.xml" checksum="b17452db4628a92f8f2054c1657125181c9b3113" manifestRefId="{e9c37c2f-aaf7-475e-bc4a-69364a89a5f6}"/>
    <ModelRepresentation name="BCode_SPE_fba3e0dfa6c8985b41bcbe3594ee941ce98b740c_b48b2d90fa045262ae3c2a0df7ec20da237e1e13" kind="BinaryCode" manifest="manifest.xml" checksum="208d95b7b7aa0b36aba930b11b88c4e2d4b7c26a" manifestRefId="{b69d4894-8fa7-4431-875e-a244e72baa44}"/>
</Content>
