<?xml version="1.0" encoding="UTF-8"?>
<Content xmlns:xsi="http://www.w3.org/2001/XMLSchema-instance" xsdVersion="0.10.0" efmiVersion="1.0.0" id="{28b32eed-2479-4843-a832-2019901e086c}" name="OpenIPSL_CHIL.Components.PSS.PSSTypeIISimpleHPF" description="PSS Type II of OpenIPSL with parametrization for eFMI use-case, replacing the derivative filter with a simplified HPF implementation." version="" generationDateAndTime="2026-04-20T11:49:10Z" generationTool="Dymola Version 2026x Refresh 1, 2026-04-08" xsi:noNamespaceSchemaLocation="./schemas/efmiContainerManifest.xsd">
    <ModelRepresentation name="ACode_Dymola" kind="AlgorithmCode" manifest="manifest.xml" checksum="de874e8c42d47fefc30f20462398664eb5943d7a" manifestRefId="{a670a5ff-d216-4025-857a-c7c4b29aed42}"/>
    <ModelRepresentation name="PCode_SPE_cb4a8a449b4ada864625ee5a4355578a3aaf08ed" kind="ProductionCode" manifest="manifest.xml" checksum="6343eeb1369ac75e8dc79480ca61aad796450036" manifestRefId="{00b8ea5d-019b-40c5-9267-98a1e336b09c}"/>
    <ModelRepresentation name="PCode_SPE_fba3e0dfa6c8985b41bcbe3594ee941ce98b740c" kind="ProductionCode" manifest="manifest.xml" checksum="93fe8ab5c4cde4169babd8f9c01c2a380ed2055d" manifestRefId="{d990be2a-742b-47a3-8b5b-81409c6becc9}"/>
    <ModelRepresentation name="BCode_SPE_cb4a8a449b4ada864625ee5a4355578a3aaf08ed_121c3a3ad3761b859035224f0aa23f4d834544e7" kind="BinaryCode" manifest="manifest.xml" checksum="bac3f1cd0380cf93b4486acac5155b1c0aaafa63" manifestRefId="{e43eb56b-222c-42c4-81e3-cbee2320eb2b}"/>
    <ModelRepresentation name="BCode_SPE_cb4a8a449b4ada864625ee5a4355578a3aaf08ed_b48b2d90fa045262ae3c2a0df7ec20da237e1e13" kind="BinaryCode" manifest="manifest.xml" checksum="a2d92939754344a8bb83ce494dd408d60f50c607" manifestRefId="{231c3c6b-8c73-4e83-9c63-8e41e8780c28}"/>
    <ModelRepresentation name="BCode_SPE_fba3e0dfa6c8985b41bcbe3594ee941ce98b740c_121c3a3ad3761b859035224f0aa23f4d834544e7" kind="BinaryCode" manifest="manifest.xml" checksum="3b91ba6920bfd6171a435fea74f6db261363ed37" manifestRefId="{f0919ca0-c5da-4dec-bba9-1ab8d3327579}"/>
    <ModelRepresentation name="BCode_SPE_fba3e0dfa6c8985b41bcbe3594ee941ce98b740c_b48b2d90fa045262ae3c2a0df7ec20da237e1e13" kind="BinaryCode" manifest="manifest.xml" checksum="71fbbac2c1457ce41d90364ae41345b58d4d663d" manifestRefId="{e67f9487-1f6d-4866-b108-7e3b2a46842c}"/>
	<ModelRepresentation name="BModel_Dymola_1d004974f9b717eea6bd89dae3a804d101968ef8" kind="BehavioralModel" manifest="manifest.xml" checksum="824de8ba02da7e483849823dc4fd4734f7eb5d72" manifestRefId="{ded1e381-8e6f-460c-89b0-a97303116cb3}"/>
	<ModelRepresentation name="BModel_Dymola_6804ca0113612a974a571222deb7d7f334df290a" kind="BehavioralModel" manifest="manifest.xml" checksum="42d9119278388c28084fcb3add93abbf6bfdb843" manifestRefId="{f94914c7-11e4-140e-b50d-2421810c04a2}"/>
</Content>
