<?xml version="1.0" encoding="UTF-8"?>
<Content xmlns:xsi="http://www.w3.org/2001/XMLSchema-instance" xsdVersion="0.10.0" efmiVersion="1.0.0" id="{ad3affee-3d5a-438f-95c1-05813a63d472}" name="efmiPSSusecase.Components.PSSTypeIImod4efmi" description="Extends the PSS Type II in OpenIPSL with parametrization for eFMI use case" version="" generationDateAndTime="2026-01-14T20:54:23Z" generationTool="Dymola Version 2026x Refresh 1 Dev 3, 2026-01-23" xsi:noNamespaceSchemaLocation="./schemas\efmiContainerManifest.xsd">
    <ModelRepresentation name="ACode_Dymola" kind="AlgorithmCode" manifest="manifest.xml" checksum="c8679bc53c3a1e7d493331ff8b7c06f68b59dad9" manifestRefId="{17262ada-749f-47c2-89c3-ec8f8a3a3ae2}"/>
    <ModelRepresentation name="PCode_SPE_cb4a8a449b4ada864625ee5a4355578a3aaf08ed" kind="ProductionCode" manifest="manifest.xml" checksum="1f9653a90b4df177c7d0bfe0d6afeee285bae5bf" manifestRefId="{d30e5dba-ee56-46cd-8ff5-c556bb546126}"/>
    <ModelRepresentation name="PCode_SPE_fba3e0dfa6c8985b41bcbe3594ee941ce98b740c" kind="ProductionCode" manifest="manifest.xml" checksum="c3ab8db9971875a29791c8cf94c5b8ee8cdd144d" manifestRefId="{4a398605-6176-483b-a080-3bf27af1c6cc}"/>
    <ModelRepresentation name="BCode_SPE_cb4a8a449b4ada864625ee5a4355578a3aaf08ed_121c3a3ad3761b859035224f0aa23f4d834544e7" kind="BinaryCode" manifest="manifest.xml" checksum="8d63345d5701c5c5404060d0676c1ef9f314a725" manifestRefId="{bf17f01b-3105-4842-809a-ed8dfde53d87}"/>
    <ModelRepresentation name="BCode_SPE_cb4a8a449b4ada864625ee5a4355578a3aaf08ed_b48b2d90fa045262ae3c2a0df7ec20da237e1e13" kind="BinaryCode" manifest="manifest.xml" checksum="8867e54c139baaedafc5841b5542faa4dbb88d49" manifestRefId="{fd2ec559-5b0c-4fc4-b30c-9af1324114ac}"/>
    <ModelRepresentation name="BCode_SPE_fba3e0dfa6c8985b41bcbe3594ee941ce98b740c_121c3a3ad3761b859035224f0aa23f4d834544e7" kind="BinaryCode" manifest="manifest.xml" checksum="d1073b1a1a9a3f2027370a2a2f4fa7df59de214c" manifestRefId="{3218d538-1459-48cc-b52e-f9e5f4006067}"/>
    <ModelRepresentation name="BCode_SPE_fba3e0dfa6c8985b41bcbe3594ee941ce98b740c_b48b2d90fa045262ae3c2a0df7ec20da237e1e13" kind="BinaryCode" manifest="manifest.xml" checksum="9261482e2d36c871a5b27a3ed7072966ee7375cf" manifestRefId="{09a50376-463a-4aeb-8e20-2398f7209144}"/>
	<ModelRepresentation name="BModel_Dymola_a3e95f8bfc8f7111ce0a5afbe91c98b3a0600eff" kind="BehavioralModel" manifest="manifest.xml" checksum="1d764ac788882bf3cd5a29140c96ee9a95468fdc" manifestRefId="{d58102a0-b638-50f9-94ba-eaa7564c7d1a}"/>
</Content>
